review_ID,review_text,rating,date,platform,sentiment_Score,,,,,,,,,,,,,,,,,,,,
80,"Tammin has been fantastic with her customer service , she really pays attention to details and always goes the extra mile to help with any issues. Big bonus is she makes the best pizzas",5,May-24,TripAdvisor,,,,,,,,,,,,,,,,,,,,,
81,"Nice hotel and very clean, Hollie made the stay much more enjoyable with her personality and customer service but was only working on our first night of the stay,

Unfortunately we had the pleasure of the 2 guys on nights for 2 nights who to be quite honest can't cook a pizza to save their lives, sorry guys but it's true, maybe a training issue or they just don't give poo,",5,May-24,TripAdvisor,,,,,,,,,,,,,,,,,,,,,
82,"I wasn't a paying guest with the hotel but a passer-by who was in a midst of panic,a sense of erency a stress heaache and 4% battery charge... I dropped in to ask a if they had a charger. The reception manager went above and beyond! Thanks a million ",5,Apr-24,TripAdvisor,,,,,,,,,,,,,,,,,,,,,
83,"We stayed with a whole schoolclass for three nights. Ibis booked us all in rooms next to each other, which was very good, and easy for us teachers, to organize with our pupils.
The staff was brilliant with our group. Thank you so much for taking care of us in your warm way. We had a great time at Ibis, and many of us really enjoyed the very nice breakfast.",5,Apr-24,TripAdvisor,,,,,,,,,,,,,,,,,,,,,
84,"The rooms are clean, the food is good and Ella tended to all our needs.

Breakfast was included each morning and it was delicious. I think that the only thing that was missing from pur rooms was a fridge. It would be nice if they could add a fridge with some beverages.",5,Apr-24,TripAdvisor,,,,,,,,,,,,,,,,,,,,,
85,"Comfortable room next to the station and good location for all major attractions by 10 minute walk. There are plenty of bars and restaurants nearby as well. Our room had all the facilities required, check in was easy and staff were very friendly. The only negative was that throughout our stay there was a buzzing sound which was constantly heard from our bedroom on the 4th floor which made sleeping a bit of a problem. Not entirely sure if this is some sort of generator, fortunately we were only staying for 2 nights otherwise this would have been a major issue.",4,Apr-24,TripAdvisor,,,,,,,,,,,,,,,,,,,,,
86,"Perfect location near the train station, nice if you have an early flight to catch. We arrived before check-in opened but if you registered on their website you got free early check-in. The hotel didn't offer any surprises, small room and tiny bathroom, but you already knew that when you booked. Perfect.",4,Apr-24,TripAdvisor,,,,,,,,,,,,,,,,,,,,,
87,"Well positioned hotel within easy walking distance of city centre. Plenty of cafes, bars, restaurants right outside including a little sainsburys and M&S food at the train station. Room was very clean with all you could need. On first arrival, we thought it was really quiet, which it was until we tried going to sleep and then realised the air con unit/ some kind of mechanical noise from above the room was actually quite noisy. Nonetheless, the staff were all very friendly, helpful and the breakfast was plentiful and delicious, in pleasant surroundings. Would definitely stay again if coming to Cambridge.
We had dinner in the bar/ restaurant next door which was also very good.",4,Apr-24,TripAdvisor,,,,,,,,,,,,,,,,,,,,,
88,"As far as hotels go, this place is excellent for its close proximity to the train station in Cambridge. Quirky interiors, welcoming and friendly check in staff. Rooms are clean, bright, and comfortable. Definitely recommend the Ibis for a Cambridge stay.",5,Apr-24,TripAdvisor,,,,,,,,,,,,,,,,,,,,,
89,"Very good team member staf. Workers are very polite and caring. Clean rooms and breakfast. Perfect location for a visit to Cambridge, every necessity nearby. The reception team was very receptive and helpful. Delicious breakfast served by Olga.",5,Jan-24,TripAdvisor,,,,,,,,,,,,,,,,,,,,,
90,We had a great time at the bar with the Queen Bee Blues Band live music! Bea and her band offer great entertainment and great music. We really enjoyed the relaxed and informal vibes and the bar has food and drinks. Well done Lucilia &team for organising these events!!,5,Jan-24,TripAdvisor,,,,,,,,,,,,,,,,,,,,,
91,"Location. Room
No bath",4,Jun-24,Booking.com,,,,,,,,,,,,,,,,,,,,,
92,"Most things.
Bathroom door hard to close due to catch spring being too stiff. When closing, lots of force required which shook the room. Other rooms had the same design problem.",4.5,Jun-24,Booking.com,,,,,,,,,,,,,,,,,,,,,
93,Friendly helpful staff,4.5,Jun-24,Booking.com,,,,,,,,,,,,,,,,,,,,,
94,"Great breakfast, nice looking, and a convenient spot.
We asked for an extra bed when we booked and they said it would be provided in advance, but they didn’t have any available when we arrived.",3.5,Jun-24,Booking.com,,,,,,,,,,,,,,,,,,,,,
95,Breakfast,4.5,Jun-24,Booking.com,,,,,,,,,,,,,,,,,,,,,
96,"Close to rail and easy walk to city centre
Bit noisy",4.5,Jun-24,Booking.com,,,,,,,,,,,,,,,,,,,,,
97,"Convenient location and comfy beds. We’ll come again!
You have to sign up to some program to leave your luggage for a few hours after checking out. It’s free but cumbersome…",4.5,Jun-24,Booking.com,,,,,,,,,,,,,,,,,,,,,
98,Clean and functional,4.5,Jun-24,Booking.com,,,,,,,,,,,,,,,,,,,,,
99,"I didn't have the included breakfast, but the food in the café downstairs was good and it was a good place to catch up on some pre-meeting work. The coffee was particularly excellent.",4.5,Jun-24,Booking.com,,,,,,,,,,,,,,,,,,,,,
100,"Had an evening meal. Pizza was good
The two for the price of one could be mix and match as long as there is no price difference there ought to be able to change.",4,Jun-24,Booking.com,,,,,,,,,,,,,,,,,,,,,
101,We had a great time at the bar with the Queen Bee Blues Band live music! Bea and her band offer great entertainment and great music. We really enjoyed the relaxed and informal vibes and the bar has food and drinks. Well done Lucilia &team for organising these events!!,5,Jan-24,TripAdvisor,,,,,,,,,,,,,,,,,,,,,
102,"This morning I dropped my partner to the station and we have often stopped in for a coffee. Well never again after the appalling service and cold watery coffee. First off the waitress taking the order did not apply the offer advertised and we very politely asked if she could rectify it. She seemed pretty annoyed and gave a distinct eye roll.
We then we waited 15 minutes and had not received our order. I noticed the waitresses chit chatting and our coffees remained cold by the machine. When my partner asked for our coffees explaining he had a train to catch the server exchanged very obvious smirks with the person she was chatting with (not sure if she worked there but the whole thing was unprofessional ) and gave us our by now cold coffees. Very unpleasant attitude and cold coffee. Thanks for ruining my morning. Will not return.",1,Jan-24,TripAdvisor,,,,,,,,,,,,,,,,,,,,,
103,"Great service indeed, nice and peaceful environment with all essential facilities! Thanks Lucilia!

The café area is really peaceful and great place to grab a coffee and work! Food is also really good, try the pizzas, they're really good!!",5,Feb-24,TripAdvisor,,,,,,,,,,,,,,,,,,,,,
104,"Stayed here with my partner. Very welcoming staff, clean room and bathroom. Absolutely nothing wrong with anything here. They have great free WiFi and a good menu of food with a bar and café downstairs. Let us leave our luggage there for the day after we checked out for free which was so helpful. Definitely would come back if I was visiting again",5,Feb-24,TripAdvisor,,,,,,,,,,,,,,,,,,,,,
105,"Our son was super happy to find this handmade train station on our arrival in the room as welcome gift . A special thanks to Leo, Susanna and Shivani for this amazing surprise! Thanks to the Ibis Cambridge Team to make us feel at home. Great location and services.",5,Mar-24,TripAdvisor,,,,,,,,,,,,,,,,,,,,,
106,"At the restaurant, Lucilia and her team treated us perfectly, we went with a large group and they did nothing but help us. The food was very delicious and abundant, and always on time. We had breakfast, lunch and dinner there and it was really great. I recommend it.`",5,Mar-24,TripAdvisor,,,,,,,,,,,,,,,,,,,,,
107,"Very welcoming, friendly reception team. Clean, comfortable room and very quiet despite the central location (I was worried it would be noisy and it was one of the quietest hotels I have been to recently). I would stay there again. Only change I would make would be to have marmelade with chunky orange pieces rather than the one they had for breakfast - everything else was great.",5,Mar-24,TripAdvisor,,,,,,,,,,,,,,,,,,,,,
108,"A welcoming, easy stay, with a great cafe and a great room. A lovely touch was being given a flower for international women's day. I actually ate in the cafe, first time ever at a hotel cafe. Lovely welcoming staff, and a really comfy, well designed room. Good value, too, given I booked last minute.",5,Mar-24,TripAdvisor,,,,,,,,,,,,,,,,,,,,,
109,"This hotel is right by the train station so very conveniently located with buses very close to take you to the city centre or a 1 mile walk into town. There’s a handy Sainsbury’s next door and some eateries.
The staff was helpful on check in. We didn’t eat at the hotel. The room was small (we were 3 people) but clean. The bathroom was cramped and weirdly shaped (and whitewashed) like the cylindrical toilets on trains. Our sink was stained which was a bit off-putting.
But other than that, cheap and cheerful and so if you’re looking for a budget stay, you can’t really go wrong.",4,Mar-24,TripAdvisor,,,,,,,,,,,,,,,,,,,,,
110,"Very central, right next to the station. Lovely decor, beautiful bar and sitting area. Friendly reception staff. Lovely room, nice bathroom pod and area for clothes. Ironing board and iron which was very handy.
The water pressure in the shower wasn’t that great in the morning and it wasn’t that hot. There could have been a couple of biscuits added to the welcome tray. There could also be more power points as there seemed to be only two where we could plug in charging devices.",4.5,Jun-24,Booking.com,,,,,,,,,,,,,,,,,,,,,
111,Parking very pricey,4,Jun-24,Booking.com,,,,,,,,,,,,,,,,,,,,,
112,Very good for overnight stay or weekend,4,Jun-24,Booking.com,,,,,,,,,,,,,,,,,,,,,
113,"The breakfast was alright
Hot breakfast wasn't that hot more like cold",3.5,Jun-24,Booking.com,,,,,,,,,,,,,,,,,,,,,
114,"Room was nice but a little smaller than expected
The sheet was dirty and had to get changed.
No drinking water in the room",4,Jun-24,Booking.com,,,,,,,,,,,,,,,,,,,,,
115,The staff are amazing! Efficient and very nice. They treat their customers well - which is rare these days.,5,Jun-24,Booking.com,,,,,,,,,,,,,,,,,,,,,
116,"Great location and far better than expected for a 3 star billing. Rooms were basic but comfortable and functional. Breakfast selections was good and I liked the 'wasted food yesterday' sign on the entrance to the breakfast room. I also liked the ground floor café area for working.
There wasn't anything not to like. More than met my expectations and I will stay again for sure.",4,Jun-24,Booking.com,,,,,,,,,,,,,,,,,,,,,
117,The food and lounge area,4.5,Jun-24,Booking.com,,,,,,,,,,,,,,,,,,,,,
118,"Quiet room fairly central and close to the station at a good price for central Cambridge.
A small fridge would have made the room perfect.",4.5,Jun-24,Booking.com,,,,,,,,,,,,,,,,,,,,,
119,"Clean rooms,helpful and friendly staff and good location near the train station
Nothing",4.5,Jun-24,Booking.com,,,,,,,,,,,,,,,,,,,,,
120,"Excellent option to stay in Cambridge. The system is a little particular since, instead of having a typical reception, you have hotel staff on the ground floor who checks you in and assigns you the room. But it is an effective and agile system that poses no problems. As for the hotel, it is modern, new, with spacious and clean rooms, without carpet and with a very comfortable bed. The location is, in my opinion, good. Next to the train station, allowing you to leave your suitcase as soon as you arrive, and about 10/15 minutes walk from the center of Cambridge in a pleasant walk. The surroundings of the hotel and the station are very good, with restaurants, a supermarket and office buildings. And all this at a reasonable price, taking into account the high prices you find in Cambridge. Come on, in my opinion, a highly recommended option.",5,Jan-24,TripAdvisor,,,,,,,,,,,,,,,,,,,,,
121,"This is without doubt one of the best ibis hotels I have stayed in.
Great location next door to the station and a warm welcome at reception.
As a gold member, the Christmas card and complimentary sweets in the room were very much appreciated.
Reasonably spacious rooms, super clean.
Nice cafe/bar area on the ground floor.",5,Jan-24,TripAdvisor,,,,,,,,,,,,,,,,,,,,,
122,"Very conveniently located, a welcoming and comfortable modern hotel right next to the station, buses and taxis.

We spent two nights here and were quite pleased with it. Staff were helpful and the room rate was competitive - unlike other hotels in Cambridge

There was also a great choice at Breakfast in a breakfast room on the 2st floor overlooking the station square",4,Jan-24,TripAdvisor,,,,,,,,,,,,,,,,,,,,,
123,"A few confusions at check-in, but otherwise everything was okay. The 5the floor room was good with a nice view of Cambridge. I liked the closeness to the railway station. Breakfast was typical for an Ibis and enjoyable. I'd be happy to stay here in the future.",4,Dec-23,TripAdvisor,,,,,,,,,,,,,,,,,,,,,
124,"Excellent mid range hotel next to the train station. The staff were all really friendly and welcoming, we were able to check in early which was a nice touch, the room was clean and modern, great buffet breakfast, and good value. Wouldn't hesitate to return.",5,Dec-23,TripAdvisor,,,,,,,,,,,,,,,,,,,,,
125,"We booked our work Christmas party. Lucilia was a great host, she planned our Christmas party to the detail, welcoming and very attentive to the group. Quick to find a way we could have music and we indeed had lots of fun. Staff very friendly and helpful. Space is cool too. Live music splendid! Only thing I could say for improvement in the future is to speed up process of delivering food to the table as it was a little cold.",5,Dec-23,TripAdvisor,,,,,,,,,,,,,,,,,,,,,
126,"We booked our work Christmas party. Lucilia was a great host, she planned our Christmas party to the detail, welcoming and very attentive to the group. Quick to find a way we could have music and we indeed had lots of fun. Staff very friendly and helpful. Space is cool too. Live music splendid! Only thing I could say for improvement in the future is to speed up process of delivering food to the table as it was a little cold.",5,Dec-23,TripAdvisor,,,,,,,,,,,,,,,,,,,,,
127,"This hotel is a gem in Cambridge. Right next to the station it’s super convenient if you’re visiting- and it’s only a 10 minute walk into the town centre. There are great bars and restaurants on station square.
The Chill02 cafe in the ground floor of the Ibis is super. AMAZING breakfast",5,Dec-23,TripAdvisor,,,,,,,,,,,,,,,,,,,,,
128,"Excellent service. Always friendly, polite and helpful staff, great food and snacks. I would recommend Ibis to anyone visiting Cambridge.
The facilities are very clean and comfortable. There is also live music in the cafe on weekends.",5,Nov-23,TripAdvisor,,,,,,,,,,,,,,,,,,,,,
129,"Convenient for the station, less so for city centre (20 min walk or 5 min bus ride). Staff very pleasant and helpful. Informal check in without a reception area worked ok. Pleasant cafe to sit in on ground floor (definitely above usual standard for hotels of this level). There are some other pleasant cafes nearby too. Room adequate - a bit shabby but clean (they need to redecorate soon), also rather noisy as the internal insulation is not great. Price on a Monday in November was a bit high for what one gets - if you have to pay £100 its worth looking for an alternative in the town centre. Otherwise the only complaint was that I left my phone charger in my room and by the time I came back to collect it a few hours later it had disappeared, presumably thrown away by the cleaning staff - poor service.",3,Nov-23,TripAdvisor,,,,,,,,,,,,,,,,,,,,,
130,"Very good selection
Everything was fine",4,Jun-24,Booking.com,,,,,,,,,,,,,,,,,,,,,
131,"It was close to the station. The hotel has a bar which is open long hours.
It was a long walk to the centre of Cambridge. However the guided bus goes to the centre.",4.5,Jun-24,Booking.com,,,,,,,,,,,,,,,,,,,,,
132,"The functionality of the accommodation, only what you needed.

Nothing was a bother, extra tea/coffee at reception if needed.

The option to skip daily room service worked well.
No draws but managed without, so it's not a real problem.",4,Jun-24,Booking.com,,,,,,,,,,,,,,,,,,,,,
133,"Convenient location next to train station.
Easy check in and checkout.
Clean.
Simple and no hassle.
Friendly staff.",4.5,Jun-24,Booking.com,,,,,,,,,,,,,,,,,,,,,
134,"Great location, friendly staff, good facilities.
The bathroom had a step at the entrance that could catch people out if they weren't careful.",4,Jun-24,Booking.com,,,,,,,,,,,,,,,,,,,,,
135,service is so good ! and the room is very clean ~!,4.5,Jun-24,Booking.com,,,,,,,,,,,,,,,,,,,,,
136,"Quick check in, great location close to station and city centre.",4.5,Jun-24,Booking.com,,,,,,,,,,,,,,,,,,,,,
137,"Excellent location within a minute of the station. Comfortable, efficient room.
Public spaces are quite small - not a hotel to lounge around in all day, but that's hardly what one would do anyway.",4,Jun-24,Booking.com,,,,,,,,,,,,,,,,,,,,,
138,"Location is good, right next to the station. Staffs are very friendly, rooms are very clean. Food trucks and taxi next by the front door.
Parking isn’t free, so hard to stop there to unload / load the luggage.",4.5,Jun-24,Booking.com,,,,,,,,,,,,,,,,,,,,,
139,"Location
The shower",4.5,Jun-24,Booking.com,,,,,,,,,,,,,,,,,,,,,
140,"We loved our stay. Friendly and helpful staff, clean rooms, very good breakfast. Great location, near the train station, near a convenience store, walking distance to many restaurants and pubs. We are planning to visit Cambridge again and we will definitely book here again.",5,Nov-23,TripAdvisor,,,,,,,,,,,,,,,,,,,,,
141,There was a really good atmosphere at the hotel. we also really enjoyed the pizza in the restaurant too. Breakfast room is also very bright and welcoming. Rooms were very clean and perfect for a short weekend break.,4,Nov-23,TripAdvisor,,,,,,,,,,,,,,,,,,,,,
142,"Standard ibis hotel but staff were very friendly and accommodating. We were a large group, check in was fast and very efficient. Bar and food offering was standard but service was great. All in all if you are looking for a launch pad to explore Cambridge this place is perfect.",5,Nov-23,TripAdvisor,,,,,,,,,,,,,,,,,,,,,
143,got put into a tiny inside room with no view whatsoever asked tochange but was refused and there must have been some empty outside rooms bathroom very small breakfast ok but wouldn.y stay there again,3,Oct-23,TripAdvisor,,,,,,,,,,,,,,,,,,,,,
144,"This would is a fairly typical contemporary Ibis conveniently located adjacent to the railway station, but a 20-minute walk, or a 5-minute bike ride into the CBD. Reasonably-priced for the UK, this property does not have any serious issues, but we hated the lack of a proper reception desk for check-in. Uncomfortably, we felt we were always in the way in front of someone trying to navigate within the hotel. This is especially awkward when we or other patrons had baggage on hand. What was management thinking?! The friendly employees here on more than one occasion expressed the dislike of the lack of a reception area. Otherwise, it delivers on the basics: cleanliness throughout, good room temperature controls, noise levels under control, reasonably comfortable bed, good toilet pressure and water temperature controls in the bathroom, sufficient supply of towels, nice lighting options in the room, enough electrical outlets to charge your piles of modern junk, workable wi-fi, competent housekeeping, and friendly and helpful staff. Having breakfast buffet over the station plaza was nice.",3,Oct-23,TripAdvisor,,,,,,,,,,,,,,,,,,,,,
145,"The hotel was so lovely, the staff were friendly and they even did a special towel arrangement and supplied a cake for my boyfriend’s 21st! The free welcome drink was also very thoughtful. The bedroom was very clean.",5,Oct-23,TripAdvisor,,,,,,,,,,,,,,,,,,,,,
146,"Very stylish hotel conveniently located next to Cambridge train station with many restaurants nearby. The historical centre is less than 30-min walk. The check-in out process is efficient and smooth. The room is clean, spacious and the bed comfortable in a cozy quiet atmosphere. It would be perfect if the hotel ant least offers some basic gym facilities. Overall I enjoyed this one night stay and will recommend this hotel definitely.",5,Oct-23,TripAdvisor,,,,,,,,,,,,,,,,,,,,,
147,"I arrived in Cambridge, having stayed at an over priced too cool for school hotel where my room was so small I couldn't open my suitcase!

I was welcomed at the hotel and quickly given my key cards. No waiting. no queues!

I went straight to my room and found it to be very clean, bright and completely functional. It had everything I needed. Very important for me, my room was completely silent. No noise from other guests.

Breakfast was good. No nonsense.

The stay was fantastic and represented great value for money.",5,Oct-23,TripAdvisor,,,,,,,,,,,,,,,,,,,,,
148,"Great well priced and well positioned if you need to get the train to newmarket for the horses. Also vicinity wise 10 minutes walk to the left there is the leisure complex with restaurants, cinema and bowling. then straight infront main high street into centre with loads of pubs and restaurants. Hotel Staff were also really welcoming and friendly.

Car parking out the front and cost us £37.50 from 2pm Friday until we left at 11am on Sunday. Their 24 hour period starts from 4am in the morning which means having to pay more than a normal hourly car park. Closest one so no real choice.

Also last thing watch out driving to hotel as our sat nav took us down a bus only lane which we didn't know we were entering until after we went through it as too busy concentrating looking for the car park and not the signs.",5,Oct-23,TripAdvisor,,,,,,,,,,,,,,,,,,,,,
149,"Great value for money
Excellent location
Clean and tidy....so it was outside around the hotel and station.
Noise from station is minimal
Staff were friendly and helpful.
Room was good.
Bed was sooooo comfy
Great night's sleep
Breakfast, was a great selection to suit all tastes and needs
Would definitely stay here again",5,Oct-23,TripAdvisor,,,,,,,,,,,,,,,,,,,,,
150,"Baby cot was really great . Breakfast is nice. Very affordable.
Super tiny room. Bathrooms are really not spacious.",3.5,Jun-24,Booking.com,,,,,,,,,,,,,,,,,,,,,
151,Good location,4,Jun-24,Booking.com,,,,,,,,,,,,,,,,,,,,,
152,"The hotel location was perfect ,so near to the station and buses",4,May-24,Booking.com,,,,,,,,,,,,,,,,,,,,,
153,"The staff. Breakfast ok for the price (12£ pp).
Small bathroom and little place do put the clothes. A bit far from the centre.",3.5,May-24,Booking.com,,,,,,,,,,,,,,,,,,,,,
154,Nice staff,4,May-24,Booking.com,,,,,,,,,,,,,,,,,,,,,
155,"Different, clean and good location",4,May-24,Booking.com,,,,,,,,,,,,,,,,,,,,,
156,"Staff were very efficient, polite and informative
When we opened the window all we could hear was the train station",3.5,May-24,Booking.com,,,,,,,,,,,,,,,,,,,,,
157,"Clean modern and well located with friendly staff
No hand towels in the bedroom and very bright lighting",4.5,May-24,Booking.com,,,,,,,,,,,,,,,,,,,,,
158,"comfortable clean room, breakfast was good and the staff were helpfull",4.5,May-24,Booking.com,,,,,,,,,,,,,,,,,,,,,
159,"Location and quietness
Bed hard , expensive",3.5,May-24,Booking.com,,,,,,,,,,,,,,,,,,,,,
160,"This hotel was a very pleasant surprise. I often find the Ibis hotels to be too basic, but this was a pleasant exception.

The reception staff was very friendly and accommodating. The room was small, but very clean and functional. There was even a place to put your suitcase on.

The bed was very comfortable and spacious. The partially open closet was practical and thanks to the shelves, it was easy to put clothes there.

There was even a desk, also with power outlets. The water boiler would benefit from a good cleaning and descaling.

The bathroom was small, but also very clean. The one thing was the water pressure. This was totally inadequate, both from the faucet, as well as the shower. Guests with long hair, better think twice before using shampoo. It may take a long time to get rid of it.

I did notify the reception about this, and it was said that somebody would take a look at it, but I did not notice any difference. Maybe it is just the way it is.

The breakfast buffet was a pleasant surprise. Lots of choices and it was kept well stocked.

Altogether I've had a good stay in this hotel.",4,Oct-23,TripAdvisor,,,,,,,,,,,,,,,,,,,,,
161,"Lovely short stay here. Really good hotel. Location was really convenient and The staff were lovely friendly and helpful. The room was clean and fresh, with some nice touches. Cafe downstairs was nice place to spend some time. To be recommended.",5,Oct-23,TripAdvisor,,,,,,,,,,,,,,,,,,,,,
