review_ID,review_text,rating,date,platform,sentiment_Score,,,,,,,,,,,,,,,,,,,,
162,"The restaurant staff are helpful and kind and respond to guests’ requests with pleasure, especially the female employee who works hard and does not hesitate to fulfill requests. We wish her more seriousness and diligence.",5,Sep-23,TripAdvisor,,,,,,,,,,,,,,,,,,,,,
163,"Ines, tania, Joana and Olga prepared us amazing diner every day, the food was very good. Made us feel like we were at home. It was amazing being at ibis Cambridge. Thank you so much for the excellent service.",5,Sep-23,TripAdvisor,,,,,,,,,,,,,,,,,,,,,
164,"The room was fine, although the bathroom was a bit small. There was no noise from outside (we were on the 5th floor, facing inwards)
Breakfast was quite good, but it was busy and tables were not being cleaned and food was not being replaced after it had run out (we had to point it out to the staff)",4,Sep-23,TripAdvisor,,,,,,,,,,,,,,,,,,,,,
165,"We had a fantastic time at the ibis Cambridge Central Station. The staff was friendly, and the breakfast was delicious. Lucília was incredible and made sure that we had all we needed for a pleasant stay. Thank you! We will definitely return and highly recommend this hotel.",5,Sep-23,TripAdvisor,,,,,,,,,,,,,,,,,,,,,
166,"We stayed for one night. They accommodated us for a late check-in which was nice. Room was what was expected: clean, simple, but up to standards and comfy. The toilet stopped working (water wouldn't stop running) so the lady who was doing the night shift came to fix it and it was fixed quickly. Only thing is that when we showered the entire bathroom floor got wet. Check out was quick and easy. The location was great: a few steps away from the station, a taxi stand right outside, bus links and a walk into the city. A very convenient hotel for a quick Cambridge stay.",5,Sep-23,TripAdvisor,,,,,,,,,,,,,,,,,,,,,
167,Special thanks to the staff and especially Ola! The bed is comfortable and the room was quiet. The restaurant is also suited and convenient for business trips. The proximity to the rail station and the bus lines to city center is a real plus.,5,Sep-23,TripAdvisor,,,,,,,,,,,,,,,,,,,,,
168,"Great location, next to train station and very close to the centre. great breakfast with lots of vegan options. Rooms are ok for a 3 star hotels. Very poor wifi that made quite difficult working from the hotel.",4,Sep-23,TripAdvisor,,,,,,,,,,,,,,,,,,,,,
169,"A very pleasant stay in a small but efficient room. The train station area has a lot of good options including a couple of excellent food trucks. It does seem to be a ""cool"" hangout area and music below,but just until 10 or so. It was about 6 pounds to Uber to the heart of the city. Would definitely stay again.",4,Sep-23,Booking.com,,,,,,,,,,,,,,,,,,,,,
170,"It was really lovely and we were welcomed with a big smile as we came in by a lovely lady who made us feel so comfortable! She was so cheery and sweet and it made us feel at ease!
There was nothing wrong with it!",4.5,May-24,Booking.com,,,,,,,,,,,,,,,,,,,,,
171,"Great location
Single beds far too small more like occasional guest beds or extra children’s beds",4,May-24,Booking.com,,,,,,,,,,,,,,,,,,,,,
172,"The breakfast was lovely, and location was fantastic
After storing our bags and dress (evening outfit) on its hanger/bag. My dress and jacket smelt very bad of Indian food. So bags were stored near kitchen.
Shower wasn’t powerful.",3.5,May-24,Booking.com,,,,,,,,,,,,,,,,,,,,,
173,"It was very clean and in a very good location for the train station and the city centre
Beds were a bit uncomfortable and the room was too hot despite turning the temperature right down.",4,May-24,Booking.com,,,,,,,,,,,,,,,,,,,,,
174,"Location and facilities were great
TV remote wasn't working and took a while to get fixed but after that everything was fine.",4,May-24,Booking.com,,,,,,,,,,,,,,,,,,,,,
175,"Good
Bathroom door didn’t close , felt very cramped",4,May-24,Booking.com,,,,,,,,,,,,,,,,,,,,,
176,"Location great. Room clean. Facilities fine. Lovely female singer in lobby as I arrived.
Normally you get a biscuit or something with your tea/coffee set. Bed was very hard, which I don’t mind but prob not everyone’s cup of tea. Shower wasn’t very powerful and only managed to get to a warm temperature. Price for one night seemed quite high. Initially was going to come with hubbie who unfortunately had to work - v disappointed that there was little difference in price from two people to one.",4,May-24,Booking.com,,,,,,,,,,,,,,,,,,,,,
177,Modern and clean,4,May-24,Booking.com,,,,,,,,,,,,,,,,,,,,,
178,"Location. Bright and fresh.
Expensive.",4,May-24,Booking.com,,,,,,,,,,,,,,,,,,,,,
179,Location and breakfast room view,4,May-24,Booking.com,,,,,,,,,,,,,,,,,,,,,
180,"The room was comfortable and clean and had everything that we needed. The staff were friendly and welcoming. I liked the fact that we could choose not to have our room cleaned every day...we can make the beds and wash up cups and dry the towels off. The only thing I would say would have been handy, would have been to have had a socket both sides of the bed?",4,Sep-23,TripAdvisor,,,,,,,,,,,,,,,,,,,,,
181,"The room was comfortable and clean and had everything that we needed. The staff were friendly and welcoming. I liked the fact that we could choose not to have our room cleaned every day...we can make the beds and wash up cups and dry the towels off. The only thing I would say would have been handy, would have been to have had a socket both sides of the bed?",4,Sep-23,TripAdvisor,,,,,,,,,,,,,,,,,,,,,
182,"Couldn't have been a better experience, the staff without exception were incredibly friendly and helpful the second we walked in the door. The wines in the bar were lovely, as was all the food, and the room was perfect with a very comfortable bed and well-appointed bathroom. Would not hesitate to return again.",5,Aug-23,TripAdvisor,,,,,,,,,,,,,,,,,,,,,
183,"This was a wonderful stay.

Location- Located in a lively hub right next to the train station we expected a noisey night but we didn't hear anything within the hotel! You can hear hustle and bustle outside but only if you choose to sleep with the windows open.
20mins walk into the centre or plenty of taxis as you step out of the hotel.
Staff- brilliant from welcome, cafe and departure. We noted it was our anniversary and received a personalised welcome in our room.
Room- very clean and comfy
Breakfast- lots of choice and replenished often

Would definitely recommend and return if we visit Cambridge again.",5,Aug-23,TripAdvisor,,,,,,,,,,,,,,,,,,,,,
184,"Convenient (in the square next to the Rail Station), and near a lot of bus routes). Basic but comfortable rooms and beds. Excellent breakfast (British and Continental styles). Good bathroom with adequate shower.",5,Aug-23,TripAdvisor,,,,,,,,,,,,,,,,,,,,,
185,"to begin with, make a claim that there are no exaggeration. great services, all the workers are trying their best to help and solve ur problems. great experience in Cambridge . especially shout out to Ms. Ola K and another lady cooperate with her, very kind and respect customers , always being positive. helps me a lot. thank all the workers efforts and leads to a fantastic experience. definitely worth the price，strongly recommended.",5,Aug-23,TripAdvisor,,,,,,,,,,,,,,,,,,,,,
186,"This is an excellent, no-frills hotel. It's located right next to the train station, making for easy arrival and departure. After a long day out, it was so nice to be able to go straight up to my room and fall into bed! Staff are very helpful, and check-in was efficient and a breeze. The rooms are small, but very clean, with a capsule style bathroom. My room was facing the train station and I slept just fine.",5,Aug-23,TripAdvisor,,,,,,,,,,,,,,,,,,,,,
187,"Great location, bang next to the train station.
We signed up for the membership and got an early checkin and complimentary drinks too. Thanks to Diandra. The rooms (twin) were comfy, with a good view of the station and the bathrooms were clean. Highly recommended for smaller trips for friends or family. The breakfast service couple have been better.",5,Aug-23,TripAdvisor,,,,,,,,,,,,,,,,,,,,,
188,"The beds are really comfortable. It would be nice if there were more space, another chair or tables, to put things on.
We totally enjoyed the breakfast and the team of Lucilia. Great to get English breakfast and so many different other things. We would like to come to Ibis Cambridge again.",4,Jul-23,TripAdvisor,,,,,,,,,,,,,,,,,,,,,
189,"If you stay here make sure you have the pizza, Carolina created a pizza for me and have had 2 weeks of terrible food as you generally do in the UK, this was simply delicious. The hotel is basic but i was there for one night and this pizza made the night",5,Jul-23,TripAdvisor,,,,,,,,,,,,,,,,,,,,,
190,"The hotel is very handy for the station, so zero hassle on arrival by train. The down-side is that the station is not in the centre of the city. In addition to the hotels own basic restaurant, there are plenty of eateries adjacent. The breakfast is a comprehensive buffet including cooked food.

Overall, it's a typical Ibis experience, no frills but fully functional and efficient, with a more comprehensive breakfast than some.
The hotel is a 15 min walk from the city centre.

I would have preferred a softer pillow.

Two people in a double room, with lots of luggage for a European tour, would have to be tidy. The rooms are not huge.

Accommodation in Cambridge is expensive.",4,May-24,Booking.com,,,,,,,,,,,,,,,,,,,,,
191,"Location right by the station is super convenient.
The rooms are nice and clean and the beds are very comfortable
Nothing to complain about",4,May-24,Booking.com,,,,,,,,,,,,,,,,,,,,,
192,The bed was really comfortable,4,May-24,Booking.com,,,,,,,,,,,,,,,,,,,,,
193,great stay - great location,4.5,May-24,Booking.com,,,,,,,,,,,,,,,,,,,,,
194,"Excellent Only problem was shower which I found rather difficult and I tended to almost swamp the bathroom! Also lack of fridge in room.
See above",4.5,May-24,Booking.com,,,,,,,,,,,,,,,,,,,,,
195,"Room was very clean and ideal for the train station.
Check in was very quick and I felt rushed",3.5,May-24,Booking.com,,,,,,,,,,,,,,,,,,,,,
196,"Very excellent breakfast varies health balanced diet seem no problem at all
Hard bed mattress, no have chest drawers, where is pair of sofa
Good accessible for mobility people but should have ground floor because fire alert, never know who can't walk for downstairs emergency exit",3.5,May-24,Booking.com,,,,,,,,,,,,,,,,,,,,,
197,"Decor, everything we needed. Clean. Nice cafe.
Beds & pillows uncomfortable",4,May-24,Booking.com,,,,,,,,,,,,,,,,,,,,, 
198,"Nice hotel, rooms and cafe.",4,May-24,Booking.com,,,,,,,,,,,,,,,,,,,,,
199,"Simple and close to train station.
Modular bathrooms+shower feel like a cheap plastic phone booth that's falling apart. Interesting concept though.",4.5,May-24,Booking.com,,,,,,,,,,,,,,,,,,,,,
200,"Super cozy atmosphere, with a great vibe. Pizzas that taste wonderful and are perfect for enjoying with the family. Very friendly service from the whole team, and especially Inês from bar chill#2. Will definitely be back ",5,Jul-23,TripAdvisor,,,,,,,,,,,,,,,,,,,,,
201,"Excellent service by the employee Inês. Very dynamic space. Excellent location. Very relaxed and bright space. Excellent food and very good quality, especially the pizzas.",5,Jul-23,TripAdvisor,,,,,,,,,,,,,,,,,,,,,
202,"Stay at an Ibis anywhere and generally you know you're going to get a good, solid and consistent experience, all at a reasonable price. This one is no exception. Location is handy. Rooms are on the small side but comfortable, and room air conditioning is a nice luxury in a country where despite climate change bringing more hot days, many hotels still have no aircon. Staff were all pleasant and helpful. Breakfast buffet fine apart from rubbery scrambled eggs. We stayed three nights.",4,Jul-23,TripAdvisor,,,,,,,,,,,,,,,,,,,,,
203,"I cannot express enough how exceptional my experience was at IBIS Cambridge, and it's all thanks to the invaluable assistance provided by Clare. As a returning guest, I have always cherished my stays at this hotel due to its unparalleled convenience, being located right next to the train station, and its unbeatable value for money. The vibrant and lively coffee shop downstairs adds to the overall delightful ambiance, and the modern, well-equipped rooms are perfectly suited to my needs.

Nevertheless, my most recent visit stands out because of the impeccable service I received from Clare, the night manager at IBIS. On the 16th of July, I arrived at the hotel, only to realize to my dismay that I had mistakenly booked my stay for the 16th of August instead. Adding to my anxiety, it was a non-refundable reservation for a nine-day stay that I had already paid for. The thought of losing hundreds of pounds and having to rebook at full cost was distressing.

In my state of worry, I shared my predicament with the front desk staff, and Sussane demonstrated remarkable understanding and compassion. She advised me to book for one night while suggesting that I sort out the situation with Viki, the General Manager, the following morning. However, before Viki even had the chance to address my concern, Clare took it upon herself to resolve the issue that very night. She managed to change my reservation to the original intended dates, without any additional charges!

I am utterly grateful to Clare, Viki, and the entire IBIS team for going above and beyond to assist me in this challenging situation. Their promptness, empathy, and efficiency turned what could have been a stressful ordeal into a seamless and pleasant experience. Clare's exceptional customer service truly saved the day, reaffirming my appreciation for the hospitality provided by IBIS Cambridge. I wholeheartedly recommend this hotel to anyone looking for a delightful stay, as the staff's dedication to guest satisfaction is truly second to none.",5,Jul-23,TripAdvisor,,,,,,,,,,,,,,,,,,,,,
204,"Staff member Lucilia made our stay much more pleasant, with her friendliness, professionalism and availability, I suggest a salary increase. Being an excellent professional management and her entire team. She helped me both at reception and in the breakfast room. Clean and new hotel.",5,Jul-23,TripAdvisor,,,,,,,,,,,,,,,,,,,,,
205,"I have stayed at many hotels closer to town over the years t double to $ and booked here only because the rest were booked out. Have to say , it was the best decision I made. This hotel is so nice, not for the frills of others but clean, friendly great location near train station and buses to town centre. Chilli Bar downstairs good for food and coffee special mention to Paul there for great customer service !",5,Jul-23,TripAdvisor,,,,,,,,,,,,,,,,,,,,,
206,"We enjoyed our stay, friendly staff, easy check in, clean room and good location.
The sights of cambridge are in walking distance. Would stay there again and recomened to friends.
One small observation, the bath towels were big and fluffy personaly would have appreciated a hand towel as well.
Check out time is noon which is a generous time",5,Jun-23,TripAdvisor,,,,,,,,,,,,,,,,,,,,,
207," Really enjoyed our stay at the Ibis. It is right next to the train station which was perfect to drop our bags off as soon as we arrived. The rooms were clean and fairly spacious. Breakfast had a really good selection of continental and traditional and was served in a comfortable room overlooking the train station. There are also a couple of nice bars next to the hotel where we enjoyed evening drinks. The staff were very helpful and welcoming. Only thing to note is that it's about a 25 min walk into central Cambridge, but a nice walk so we didn't mind.",5,Jun-23,TripAdvisor,,,,,,,,,,,,,,,,,,,,,
208,"I used to really enjoy it, however, I find sometimes the staff can be rude, for example, I found my drink to be very strong and simply asked if more milk could be added ( considering it cost £4.10 I thought this a fair request ) however they refused and said that they would not do this, this was upsetting due to how expensive the latte was.",1,Jun-23,TripAdvisor,,,,,,,,,,,,,,,,,,,,,
209,"I hired a meeting room for a company team meeting recently. The facilities were first class. Clean, well presented and perfect for facilitating a small team meeting. The team were very helpful. It all went very smoothly.",5,Jun-23,TripAdvisor,,,,,,,,,,,,,,,,,,,,,
210,The location was very good and the breakfast was very good to,4.5,May-24,Booking.com,,,,,,,,,,,,,,,,,,,,,
211,"Well located hotel. Very comfortable bed and very functional room. Very quiet too.
",4,May-24,Booking.com,,,,,,,,,,,,,,,,,,,,,
212,"The location is really convenient for railway station, if you need to go to central Cambridge, just take a bus or walk like 25min. The staff is friendly and there are bar and cafe on the ground floor, also some food choices and Sainsbury's local just a few metres away.
The window couldn't be opened which I understand for safety reason, although a little bit lack of fresh air. The biggest problem is the hot water from shower wasn't warm at all, just slightly better than cold water. And it could be only opened for half amount.I guess maybe due to control of use of water, but the temperature wasn't warm enough at all. So I took an awful shower that night. Strangely, the tap water for the basin can be very warm, which is ok.",3.5,May-24,Booking.com,,,,,,,,,,,,,,,,,,,,,
213,The price was very competitive with other nearby hotels,4.5,May-24,Booking.com,,,,,,,,,,,,,,,,,,,,,
214,"Very near station. Friendly welcome and a cheerful lounge and cafe bar at the entrance.
Breakfast with a view over the station square was good.    No view from the bedroom window.",4,May-24,Booking.com,,,,,,,,,,,,,,,,,,,,,
215,"The hotel is right next to the Station which is very nice if you arrive late at night. It is a fair but very do-able walk if one is visiting the University, with lots of lovely bakeries and coffee shops along the way. The room was very nice and clean. The decor is minimalist but the design is very clever. They happily stored our luggage for us after we had checked out, until we left on the train later in the day.
The in-house eating offering did not really appeal to us but there are quite a few eating places in the square around the hotel - however, many of these were closed by the time we arrived quite late at night.",4,May-24,Booking.com,,,,,,,,,,,,,,,,,,,,,
216,"Good location, easy access to station and city centre
The fan in the room above the door would hit the door hinge at the top of the door when it was on, which would sound as though someone was coming into the room, disrupting my sleep a lot of the time",3.5,May-24,Booking.com,,,,,,,,,,,,,,,,,,,,,
217,"I liked the well laid out room with space to work and stash stuff. It was perfect for a 1/2 night business trip.
Shower a bit weedy!",4,May-24,Booking.com,,,,,,,,,,,,,,,,,,,,,
218,Close proximity to the train station and city centre.,4.5,May-24,Booking.com,,,,,,,,,,,,,,,,,,,,,
219,Very clean room and friendly staff. Great value for money,4.5,May-24,Booking.com,,,,,,,,,,,,,,,,,,,,,
220,"Susanna on reception friendly, and helpful, and close to cambridge train station
Shame cafe shut at 10.45pm for drinks",4,May-24,Booking.com,,,,,,,,,,,,,,,,,,,,,
221,"Convenient for station.
Expensive, for accommodation so far from city centre.",3.5,May-24,Booking.com,,,,,,,,,,,,,,,,,,,,,
222,"The room was clean and comfortable and in its proximity to Cambridge Station was ideal for an overnight before moving on to Stansted Airport.
No obvious criticisms apart from the crudity of the wall decor throughout the hotel.",4.5,May-24,Booking.com,,,,,,,,,,,,,,,,,,,,,
223,"Cleaned, very central
No toilet brush",4,May-24,Booking.com,,,,,,,,,,,,,,,,,,,,,
224,"Good location. Simple room.
A bit noisy. The isolation wasn't great.",3.5,May-24,Booking.com,,,,,,,,,,,,,,,,,,,,,
225,Excellent location. Hotel good in all aspects,4.5,May-24,Booking.com,,,,,,,,,,,,,,,,,,,,,
226,Location and staff were great,4.5,May-24,Booking.com,,,,,,,,,,,,,,,,,,,,,
227,"Room was with Shower, hairdryer, eletric kettle and in a very quite area no outside noise. Enough space for luggages. Location was next to the train station, bus station, pubs, cafes and a supermarket. Breakfast included hot food (English Breakfast) and some cold food (Continental)
Breakfast",3.5,May-24,Booking.com,,,,,,,,,,,,,,,,,,,,,
228,"Conveniently located next to the station, but within walking distance of a good range of restaurants (Mill Road). Good sized rooms, excellent breakfast",4,May-24,Booking.com,,,,,,,,,,,,,,,,,,,,,
229,"clean and sufficient, convenient location right next to train station.",4,May-24,Booking.com,,,,,,,,,,,,,,,,,,,,,
230,"A great stay at the Ibis, ideal for the station (couldn’t hear any trains). It’s about a 25-30 min walk to the Centre which suited us, plenty of pubs and restaurants nearby. Breakfast was very good and so were the hotel staff, we parked in the Leisure car park (about a 10 min walk) where you get a discount if you’re staying at the Ibis. You need to ask for the car park discount code when you check out, you then scan it when you’re paying at the car park. Would stay here again.",5,Jun-23,TripAdvisor,,,,,,,,,,,,,,,,,,,,,
231,"We went to the Ibis yesterday for the Greek night and it was absolutely amazing! The music was great and we had a great night.
Good vibes , nice drinks and food. looking forward for the next one",5,Jun-23,TripAdvisor,,,,,,,,,,,,,,,,,,,,,
232,Paul and Ines from the bar were amazing! Lucilia was a great host! We went to this Greek event and it was absolutely fantastic! 10/10! Chloe went the extra mile to ensure we had a booking for that night! Thank you all so much for this wonderful evening! 10/10,5,Jun-23,TripAdvisor,,,,,,,,,,,,,,,,,,,,,
233,"We attended an event with my friends, it was lovely. The food was very tasty and the atmosphere very friendly. Definitely suggest Ibis.  Lucilia was amazing and helped us with everything we needed. All the staff was amazing and super friendly!!",5,Jun-23,TripAdvisor,,,,,,,,,,,,,,,,,,,,,
234,"Highly recommended
Very welcoming, and informative staff, funky reception,diner and bar. Comfortable rooms all a stones throw from rail station and a mile from city centre.
There are pub diners, cafes, sainsburys and bus stops
Nearby
No complaints",4,Jun-23,TripAdvisor,,,,,,,,,,,,,,,,,,,,,
235,"Amazing welcome and check in thanks to Diandra. Beautiful girl and very helpful. The room was perfect for our stay , clean and had everything we need for a lovely stay. Next time I’m going to stay more time for sure. 10/10",5,May-23,TripAdvisor,,,,,,,,,,,,,,,,,,,,,
236,"Lovely pizzas at the Chill cafe. Raquel was very attentive and gave us orange slices in our water. Quiet and relaxing setting. Train information displayed, comfy seats. Didn’t try the hotel itself so can’t comment on that.",5,May-23,TripAdvisor,,,,,,,,,,,,,,,,,,,,,
237,Popped in to chill for the first time in months. Had a bite to eat and a coffee. Served by Tammin who was most polite and welcoming. Planning on returning soon with family. Keep up the good work!,5,May-23,TripAdvisor,,,,,,,,,,,,,,,,,,,,,
238,"For a very long time now I’ve been coming to Chill lounge to finish work. I truly appreciate this place’s cleanliness, professionalism and of course its amazing coffee and super friendly staff! In particular Tammin who introduced me to the delicious chai latte!",5,May-23,TripAdvisor,,,,,,,,,,,,,,,,,,,,,
239,"Convenient Location - Close to Railway station.

BUT 
 It is very noisy with clanging doors from nearby rooms and the floors above and below. Seems like the bath bathroom modules have been poorly installed or designed so that the doors bang.
Thee room doors are badly sprung and slam unconsolably.
The room have very poor storage.
The dangling electric cables leading to the bedside lamps are potentially dangerous.",2,May-23,TripAdvisor,,,,,,,,,,,,,,,,,,,,,
240,"Quirky place right by the station, really convenient. Comfy bed, nice staff and nice vibe in the bar too.",4.5,Apr-24,Booking.com,,,,,,,,,,,,,,,,,,,,,
241,Close to train station,4.5,Apr-24,Booking.com,,,,,,,,,,,,,,,,,,,,,
242,"Conveniently located for the rail station
No irons, you have to use an ironing room which is communal, breakfast not great",3.5,Apr-24,Booking.com,,,,,,,,,,,,,,,,,,,,,
243,Breakfast was good,4.5,Apr-24,Booking.com,,,,,,,,,,,,,,,,,,,,,
244,"Super location, right at the Cambridge train station, with bus connections to everywhere in Cambridge.
Friendly staff, good vibe overall.

Room is spacious, bed is comfy, shower water pressure is strong.
Breakfast can be improved with more choices",4,Apr-24,Booking.com,,,,,,,,,,,,,,,,,,,,,
245,"Friendly staff and 24hr bar
I wish I had hangers",4.5,Apr-24,Booking.com,,,,,,,,,,,,,,,,,,,,,
246,Very satisfied overall.,4.5,Apr-24,Booking.com,,,,,,,,,,,,,,,,,,,,,
247,"Handy location. Nice room , nice breakfast
Very noisy from the road outside, too near many noisy pubs especially Saturday night .room could be bigger",3.5,Apr-24,Booking.com,,,,,,,,,,,,,,,,,,,,,
248,"Near to the Cambridge Railway station, restaurants,bus station, supermarket
Nothing..everything perfect for me",4.5,Apr-24,Booking.com,,,,,,,,,,,,,,,,,,,,,
249,"The staff was amazing and the room was pretty big
The shower wasn’t really clean and it also had some sort of hook which made it impossible for me to take the shower head and place it as desired while showering",3.5,Apr-24,Booking.com,,,,,,,,,,,,,,,,,,,,,
250,"Very poor breakfasts. Little choice, if u vegan u gonna starve",3.5,Apr-24,Booking.com,,,,,,,,,,,,,,,,,,,,,
